{"$defs":{"hash":{"pattern":"^[0-9a-f]{64}$","type":"string"},"nat":{"pattern":"^(0|[1-9][0-9]*)$","type":"string"}},"$id":"https://example.invalid/collatz/engine-result-v1.schema.json","$schema":"https://json-schema.org/draft/2020-12/schema","additionalProperties":false,"properties":{"binary_sha256":{"$ref":"#/$defs/hash"},"config_id":{"$ref":"#/$defs/hash"},"counters":{"additionalProperties":false,"patternProperties":{"^(bound_prunes|deterministic_nodes|deterministic_values|final_intervals|prefix_prunes|recursive_nodes|represented_input_count|level_[1-9][0-9]*)$":{"$ref":"#/$defs/nat"}},"type":"object"},"engine":{"enum":["cpp-gmp-prover","independent-rust-verifier"]},"hits":{"$ref":"#/$defs/nat"},"math_certificate_sha256":{"$ref":"#/$defs/hash"},"max_integer_bits":{"$ref":"#/$defs/nat"},"outcome":{"enum":["NO_SURVIVOR","SURVIVOR","ERROR"]},"result_id":{"$ref":"#/$defs/hash"},"schema":{"const":"collatz.engine-result.v1"},"semantic_parameters":{"additionalProperties":false,"properties":{"enum_threshold":{"pattern":"^[1-9][0-9]*$","type":"string"}},"required":["enum_threshold"],"type":"object"},"source_sha256":{"$ref":"#/$defs/hash"},"unit_id":{"$ref":"#/$defs/hash"}},"required":["binary_sha256","config_id","counters","engine","hits","math_certificate_sha256","max_integer_bits","outcome","result_id","schema","semantic_parameters","source_sha256","unit_id"],"title":"Exact search-engine result for one work unit","type":"object"}
