{"binary_sha256":"39c4568d84879e14e9d6dfbb7dad90e4f814e0f663eb294ed63aa6744aa09594","config_id":"8860c544c8915438469a4eccdd607f7d32afe7d0403a1c7d6a7445159358cead","counters":{"bound_prunes":"14861","deterministic_nodes":"1246441","deterministic_values":"1236753","final_intervals":"0","level_1":"534","level_2":"49391","level_3":"0","prefix_prunes":"4","recursive_nodes":"49926","represented_input_count":"30064771072"},"engine":"independent-rust-verifier","hits":"0","math_certificate_sha256":"e5f3e478953e551fb7be6eb43511dad02364d00f48a8f91060346246a6d1ce55","max_integer_bits":"102","outcome":"NO_SURVIVOR","result_id":"167ad037d896847ade1e6596c2215f8460e97f6f79f494b98e9e47bd4e25821e","schema":"collatz.engine-result.v1","semantic_parameters":{"enum_threshold":"256"},"source_sha256":"1033fbd5df637fa5badd2a8f3c760d066c32146eadf36e7fd2221996e083ce04","unit_id":"5829fdd7369be146e2016e161c6883447320468ba839967a55963044d6752d91"}
