{"binary_sha256":"10ffa2fba9669a2c205268867e19f855c64335d522ab07e6d496283105fa7733","config_id":"b95bbdd3004aa0147070166059cccb4b7e0db7a131150f253e6fcb6c6f102098","counters":{"bound_prunes":"360","deterministic_nodes":"7450","deterministic_values":"7450","final_intervals":"0","level_1":"540","level_2":"0","prefix_prunes":"0","recursive_nodes":"541","represented_input_count":"216466351718"},"engine":"cpp-gmp-prover","hits":"0","math_certificate_sha256":"e5f3e478953e551fb7be6eb43511dad02364d00f48a8f91060346246a6d1ce55","max_integer_bits":"56","outcome":"NO_SURVIVOR","result_id":"844953c0d5d41db6a0ea0bf9ade483057bf0dc4e646475b6ae6de1ea4dcd6839","schema":"collatz.engine-result.v1","semantic_parameters":{"enum_threshold":"256"},"source_sha256":"d3780352c2d8330aa252a1f5c23dbcb2c23af3e37ee6ab66c62b0787d3f30bc2","unit_id":"5cae0779dbfe8f48a64f9e32b966d1309913dc8c9a090ece7993e9d67cfc7327"}
