{"binary_sha256":"39c4568d84879e14e9d6dfbb7dad90e4f814e0f663eb294ed63aa6744aa09594","config_id":"7add73f82f81f6cd6a848b0c782c7e7344740c535af7a7de8166a6e7a046de1d","counters":{"bound_prunes":"1087081977","deterministic_nodes":"165856628022","deterministic_values":"158015109093","final_intervals":"0","level_1":"555","level_2":"112044","level_3":"8578782","level_4":"310231963","level_5":"6063989287","level_6":"0","level_7":"0","prefix_prunes":"27264864","recursive_nodes":"6382912632","represented_input_count":"3940649673949184"},"engine":"independent-rust-verifier","hits":"0","math_certificate_sha256":"e5f3e478953e551fb7be6eb43511dad02364d00f48a8f91060346246a6d1ce55","max_integer_bits":"102","outcome":"NO_SURVIVOR","result_id":"81f97b4622bf9b55bbc44db1eb78f6a0a0b54d3f2db626f59ada650c58a9fcce","schema":"collatz.engine-result.v1","semantic_parameters":{"enum_threshold":"256"},"source_sha256":"1033fbd5df637fa5badd2a8f3c760d066c32146eadf36e7fd2221996e083ce04","unit_id":"e66ef27726c079dbe39c4ae46d09bb0bed5f72c905a85806a8019210c1a566ae"}
