{"binary_sha256":"10ffa2fba9669a2c205268867e19f855c64335d522ab07e6d496283105fa7733","config_id":"39358f1f272587ce9bdd2ff4d530f9a9fe079894092f634e6b9e468bc999b419","counters":{"bound_prunes":"4951887","deterministic_nodes":"190643593","deterministic_values":"189353474","final_intervals":"0","level_1":"365","level_2":"97284","level_3":"10830671","level_4":"0","level_5":"0","prefix_prunes":"36902","recursive_nodes":"10928321","represented_input_count":"13258597302978740224"},"engine":"cpp-gmp-prover","hits":"0","math_certificate_sha256":"e5f3e478953e551fb7be6eb43511dad02364d00f48a8f91060346246a6d1ce55","max_integer_bits":"104","outcome":"NO_SURVIVOR","result_id":"346c56ce59244a65967f8365ac6fd52c843c50ebdb1796d11cb8e08ea4caf1df","schema":"collatz.engine-result.v1","semantic_parameters":{"enum_threshold":"256"},"source_sha256":"d3780352c2d8330aa252a1f5c23dbcb2c23af3e37ee6ab66c62b0787d3f30bc2","unit_id":"033aaeb6c4db879c3895d5684d80d2c332a7211a60d5799c3a36afcedef497f0"}
