{"binary_sha256":"10ffa2fba9669a2c205268867e19f855c64335d522ab07e6d496283105fa7733","config_id":"d58709ce6b8da2cf7db0de16e3b5dba5f0a760880fd306be9ef1440b39333bd5","counters":{"bound_prunes":"87777715","deterministic_nodes":"7165869566","deterministic_values":"6995766997","final_intervals":"0","level_1":"559","level_2":"113070","level_3":"8823555","level_4":"327515650","level_5":"0","level_6":"0","prefix_prunes":"59088","recursive_nodes":"336452835","represented_input_count":"6473924464345088"},"engine":"cpp-gmp-prover","hits":"0","math_certificate_sha256":"e5f3e478953e551fb7be6eb43511dad02364d00f48a8f91060346246a6d1ce55","max_integer_bits":"102","outcome":"NO_SURVIVOR","result_id":"759c485dcdf0d4492b8377f8287f623c7378eef9e9325dd1d633a6930bb3190d","schema":"collatz.engine-result.v1","semantic_parameters":{"enum_threshold":"256"},"source_sha256":"d3780352c2d8330aa252a1f5c23dbcb2c23af3e37ee6ab66c62b0787d3f30bc2","unit_id":"b30fbee45b52871148b786f5db07e2dbe659e223662836a40634ce7ba9597dda"}
