{"binary_sha256":"10ffa2fba9669a2c205268867e19f855c64335d522ab07e6d496283105fa7733","config_id":"7add73f82f81f6cd6a848b0c782c7e7344740c535af7a7de8166a6e7a046de1d","counters":{"bound_prunes":"43758","deterministic_nodes":"103936580","deterministic_values":"69611022","final_intervals":"0","level_1":"372","level_2":"17697","level_3":"236012","level_4":"1166119","level_5":"2432244","level_6":"0","level_7":"0","prefix_prunes":"118138","recursive_nodes":"3852445","represented_input_count":"117440512"},"engine":"cpp-gmp-prover","hits":"0","math_certificate_sha256":"e5f3e478953e551fb7be6eb43511dad02364d00f48a8f91060346246a6d1ce55","max_integer_bits":"104","outcome":"NO_SURVIVOR","result_id":"0a7f8ee7f2b01da9475a59f9aceea5f5421c9e53da8249426054540edd43dbae","schema":"collatz.engine-result.v1","semantic_parameters":{"enum_threshold":"256"},"source_sha256":"d3780352c2d8330aa252a1f5c23dbcb2c23af3e37ee6ab66c62b0787d3f30bc2","unit_id":"48fb715ea504562b16bebf73bc69ea17c67d0b47cabff52484e0e48c98344da2"}
