{"binary_sha256":"39c4568d84879e14e9d6dfbb7dad90e4f814e0f663eb294ed63aa6744aa09594","config_id":"b95bbdd3004aa0147070166059cccb4b7e0db7a131150f253e6fcb6c6f102098","counters":{"bound_prunes":"6","deterministic_nodes":"2016","deterministic_values":"2016","final_intervals":"0","level_1":"87","level_2":"0","prefix_prunes":"0","recursive_nodes":"88","represented_input_count":"6451"},"engine":"independent-rust-verifier","hits":"0","math_certificate_sha256":"e5f3e478953e551fb7be6eb43511dad02364d00f48a8f91060346246a6d1ce55","max_integer_bits":"96","outcome":"NO_SURVIVOR","result_id":"1fa33e6734b0328f196697b3ed154686904ec8f9d800c09e683daa7ebd29b2b1","schema":"collatz.engine-result.v1","semantic_parameters":{"enum_threshold":"256"},"source_sha256":"1033fbd5df637fa5badd2a8f3c760d066c32146eadf36e7fd2221996e083ce04","unit_id":"fc05ec2435afa2f4f808ac1dcc7ecaa414a70b9ec933784e276389642611c8a8"}
