{"binary_sha256":"39c4568d84879e14e9d6dfbb7dad90e4f814e0f663eb294ed63aa6744aa09594","config_id":"39358f1f272587ce9bdd2ff4d530f9a9fe079894092f634e6b9e468bc999b419","counters":{"bound_prunes":"3024714","deterministic_nodes":"165744277","deterministic_values":"163902694","final_intervals":"0","level_1":"617","level_2":"115928","level_3":"8338253","level_4":"0","level_5":"0","prefix_prunes":"38560","recursive_nodes":"8454799","represented_input_count":"1618481116086272"},"engine":"independent-rust-verifier","hits":"0","math_certificate_sha256":"e5f3e478953e551fb7be6eb43511dad02364d00f48a8f91060346246a6d1ce55","max_integer_bits":"104","outcome":"NO_SURVIVOR","result_id":"f6464c113dbbb335ddcfe5a153e9bbf2a59528ff8f8b91be352db43b0943a9e3","schema":"collatz.engine-result.v1","semantic_parameters":{"enum_threshold":"256"},"source_sha256":"1033fbd5df637fa5badd2a8f3c760d066c32146eadf36e7fd2221996e083ce04","unit_id":"00a395bd54b6a8839c1d369e7d4e45509041977ea149ea4a7eeba1193e637ee3"}
