{"binary_sha256":"39c4568d84879e14e9d6dfbb7dad90e4f814e0f663eb294ed63aa6744aa09594","config_id":"d58709ce6b8da2cf7db0de16e3b5dba5f0a760880fd306be9ef1440b39333bd5","counters":{"bound_prunes":"0","deterministic_nodes":"35328","deterministic_values":"11776","final_intervals":"0","level_1":"97","level_2":"514","level_3":"220","level_4":"0","level_5":"0","level_6":"0","prefix_prunes":"71","recursive_nodes":"832","represented_input_count":"11776"},"engine":"independent-rust-verifier","hits":"0","math_certificate_sha256":"e5f3e478953e551fb7be6eb43511dad02364d00f48a8f91060346246a6d1ce55","max_integer_bits":"104","outcome":"NO_SURVIVOR","result_id":"4aadcf2a371c5111866e7a4b9055e3d5ec8cbe16c76dbb362040ffbca3ce2cd3","schema":"collatz.engine-result.v1","semantic_parameters":{"enum_threshold":"256"},"source_sha256":"1033fbd5df637fa5badd2a8f3c760d066c32146eadf36e7fd2221996e083ce04","unit_id":"1bd5c522ed34efa51cbcb87854da30ea3899e6b2337517e4c49b32fa6ab85934"}
