{"binary_sha256":"10ffa2fba9669a2c205268867e19f855c64335d522ab07e6d496283105fa7733","config_id":"8860c544c8915438469a4eccdd607f7d32afe7d0403a1c7d6a7445159358cead","counters":{"bound_prunes":"62748","deterministic_nodes":"1854498","deterministic_values":"1850466","final_intervals":"0","level_1":"476","level_2":"108977","level_3":"0","prefix_prunes":"4","recursive_nodes":"109454","represented_input_count":"126100789566373888"},"engine":"cpp-gmp-prover","hits":"0","math_certificate_sha256":"e5f3e478953e551fb7be6eb43511dad02364d00f48a8f91060346246a6d1ce55","max_integer_bits":"102","outcome":"NO_SURVIVOR","result_id":"eadaaf75cbab861ee76704d1346d3dd46aca572295d8558ecfbbf11b5f65e109","schema":"collatz.engine-result.v1","semantic_parameters":{"enum_threshold":"256"},"source_sha256":"d3780352c2d8330aa252a1f5c23dbcb2c23af3e37ee6ab66c62b0787d3f30bc2","unit_id":"ebd7b6efdb5ee10aaf8826fc04cc35abcdf85ded3cde804f340740bb5b5c9c2a"}
